{
  "id": "550e8400-e29b-41d4-a716-446655440005",
  "name": "Feedback Loop",
  "description": "A complex machine implementing a controlled feedback mechanism.",
  "elements": [
    {
      "id": "111e8400-e29b-41d4-a716-446655440111",
      "name": "Source",
      "description": "Source generator for the feedback loop structure.",
      "params": "type: pulse, width: 0.25, sync: internal",
      "externalInput": {
        "hasExternalInput": false
      },
      "externalOutput": {
        "hasExternalOutput": true
      },
      "sendTo": [
        {
          "id": "222e8400-e29b-41d4-a716-446655440222",
          "idRef": "333e8400-e29b-41d4-a716-446655440333",
          "description": "Send source signal to the processing unit."
        }
      ]
    },
    {
      "id": "333e8400-e29b-41d4-a716-446655440333",
      "name": "Processor",
      "description": "Main processor that accepts feedback from the sink.",
      "params": "mode: add, clipping: hard, wet: 0.75",
      "externalInput": {
        "hasExternalInput": true
      },
      "externalOutput": {
        "hasExternalOutput": true
      },
      "sendTo": [
        {
          "id": "444e8400-e29b-41d4-a716-446655440444",
          "idRef": "555e8400-e29b-41d4-a716-446655440555",
          "description": "Route processed signal to the feedback sink."
        }
      ]
    },
    {
      "id": "555e8400-e29b-41d4-a716-446655440555",
      "name": "Sink",
      "description": "Feedback sink that returns signal to the processor.",
      "params": "delay: 1.5ms, feedback: 0.3, phase: 180deg",
      "externalInput": {
        "hasExternalInput": true
      },
      "externalOutput": {
        "hasExternalOutput": false
      },
      "sendTo": [
        {
          "id": "666e8400-e29b-41d4-a716-446655440666",
          "idRef": "333e8400-e29b-41d4-a716-446655440333",
          "description": "Close the loop by sending back to processor."
        }
      ]
    }
  ]
}