{
  "id": "550e8400-e29b-41d4-a716-446655440003",
  "name": "Simple Bypass",
  "description": "A simple machine that passes input to output without changes.",
  "elements": [
    {
      "id": "d44e8400-e29b-41d4-a716-446655440555",
      "name": "Bypass Node",
      "description": "Pass-through node for signal routing and verification.",
      "params": "gain: 1.0, latency: 0ms, mode: transparent",
      "externalInput": {
        "hasExternalInput": true
      },
      "externalOutput": {
        "hasExternalOutput": true
      },
      "sendTo": []
    }
  ]
}