{
  "id": "550e8400-e29b-41d4-a716-446655440008",
  "name": "Stereo Panner",
  "description": "Spatial processing machine for wide stereo soundstage.",
  "elements": [
    {
      "id": "pan1-8400-e29b-41d4-a716-44665544011",
      "name": "Pan Center",
      "description": "Automated panner moving signal across horizontal axis.",
      "params": "width: 1.0, center: 0.0, law: equal-power",
      "externalInput": {
        "hasExternalInput": true
      },
      "externalOutput": {
        "hasExternalOutput": true
      },
      "sendTo": []
    }
  ]
}