{
  "id": "a1b2c3d4-e5f6-7a8b-9c0d-1e2f3a4b5c6d",
  "name": "Oscillator Core Pro",
  "description": "Nucleo generador de audio primario diseñado para proporcionar fuentes sonoras de alta pureza espectral. Este modulo implementa tecnicas de sintesis de tabla de ondas y generacion analogica virtual mediante algoritmos de sobremuestreo que minimizan el aliasing. Es el primer eslabon de la cadena de señal donde se definen las caracteristicas del timbre inicial que sera procesado posteriormente. Su arquitectura permite la mezcla de hasta cuatro fuentes independientes con coherencia de fase perfecta garantizando una base solida para cualquier sonido complejo que se pretenda crear.",
  "elements": [
    {
      "id": "771e8400-e29b-41d4-a716-446655440111",
      "name": "Sine Wave Gen",
      "description": "Generador de onda senoidal de alta precision con distorsion armonica total minimizada para proporcionar una base tonal limpia y pura. Este elemento es ideal para subgraves o para añadir una fundamental solida a sonidos mas complejos sin introducir armonicos no deseados que ensucien la mezcla final en el espectro bajo.",
      "params": "Frecuencia Base: 20Hz-20kHz, Amplitud: -inf/+6dB, Fase en Grados: 0-360, Tracking: On/Off, Glide: 0-1000ms, Sync: Internal/External, Drift: 0-10",
      "externalInput": { "hasExternalInput": false },
      "externalOutput": { "hasExternalOutput": false },
      "sendTo": [
        {
          "id": "b22e8400-e29b-41d4-a716-446655440333",
          "idRef": "881e8400-e29b-41d4-a716-446655440222",
          "description": "Envia la señal pura del oscilador senoidal hacia el mezclador de salida interno para ser combinada con el resto de fuentes sonoras."
        }
      ]
    },
    {
      "id": "881e8400-e29b-41d4-a716-446655440222",
      "name": "Osc Mixer Output",
      "description": "Etapa de mezcla interna que consolida todas las fuentes de audio del nucleo de oscilacion antes de enviarlas al bus de salida externo. Este elemento actua como el nodo final de la maquina y es responsable de asegurar que el rango dinamico sea respetado y que no ocurra saturacion digital antes de que la señal abandone este modulo hacia el procesador de filtrado principal.",
      "params": "Volumen Mezcla: 0-100%, Panoramizacion: L-R, Limitador: On/Off, Soft Clip: 0-10, Ganancia de Salida: -24dB/+12dB, Mono/Stereo, Metering: Peak/RMS",
      "externalInput": { "hasExternalInput": false },
      "externalOutput": {
        "hasExternalOutput": true,
        "description": "Salida de audio compuesta de todos los osciladores activos de esta maquina hacia el bus de procesamiento externo del sistema."
      },
      "sendTo": []
    },
    {
      "id": "991e8400-e29b-41d4-a716-446655440333",
      "name": "Sync Master Clock",
      "description": "Generador de pulsos de sincronia que coordina la fase de todos los osciladores internos para asegurar un ataque consistente. Este modulo no genera audio audimble por si solo pero es vital para tecnicas de hard sync que producen timbres agresivos y ricos en armonicos superiores que son caracteristicos de los sintetizadores analogicos de mayor renombre en la industria.",
      "params": "BPM Host: 40-300, Multiplicador: 1/128-32n, Swing: 0-100%, Offset Sync: -50ms/+50ms, Reset on Play: true/false, Trigger Source: Internal",
      "externalInput": { 
        "hasExternalInput": true,
        "description": "Entrada de reloj externo para sincronizar el nucleo de oscilacion con el tempo del proyecto global o de otras maquinas."
      },
      "externalOutput": { "hasExternalOutput": false },
      "sendTo": []
    }
  ]
}
