{
  "id": "d4e5f6a7-b8c9-0d1e-2f3a-4b5c6d7e8f90",
  "name": "Effect Rack Studio",
  "description": "Unidad de post-procesamiento final que añade dimension espacial y pulido sonoro. Incluye algoritmos de reverb por convolucion, delay de cinta y distorsion armonica de alta gama. Su funcion principal es situar el sonido en un espacio acustico virtual creíble o transformarlo en texturas irreconocibles mediante procesado extremo. Es el ultimo eslabon de la cadena CIM donde se define el acabado estetico del sonido antes de ser entregado al bus de grabacion o mezcla principal de la plataforma de produccion musical.",
  "elements": [
    {
      "id": "772e8400-e29b-41d4-a716-446655440111",
      "name": "Audio FX Input",
      "description": "Punto de entrada de audio para el rack de efectos finales. Recibe señales mono o estereo de alta fidelidad para ser distribuidas entre los diferentes modulos. Incluye un control de nivel de entrada y un medidor de picos para asegurar que la señal entrante no sature las etapas de procesamiento digital posteriores, manteniendo siempre la maxima claridad y el menor ruido de fondo posible en la cadena de señal final del sintetizador profesional.",
      "params": "Input Trim: -12/+12dB, Meter Mode: Peak/RMS, Input Mute: true/false, Phase Check: dual, Stereo Width: 0-100%, Noise Gate: -80dB",
      "externalInput": {
        "hasExternalInput": true,
        "description": "Entrada de audio para procesamiento de efectos finales desde el procesador de filtros o fuentes externas."
      },
      "externalOutput": { "hasExternalOutput": false },
      "sendTo": [
        {
          "id": "a11e8400-e29b-41d4-a716-446655440333",
          "idRef": "882e8400-e29b-41d4-a716-446655440222",
          "description": "Envia la señal de audio de entrada hacia el procesador de retardo (delay) para añadir ecos e repeticiones ritmicas."
        }
      ]
    },
    {
      "id": "882e8400-e29b-41d4-a716-446655440222",
      "name": "Tape Delay Sim",
      "description": "Simulacion de retardo de cinta analogico que añade calor y sutiles variaciones de tono a las repeticiones. Este efecto es esencial para crear profundidad espacial y ritmos complejos. Permite sincronizacion al tempo del proyecto y ofrece control de realimentacion que puede llegar a la auto-oscilacion para efectos experimentales y de transicion apreciados en generos como el dub, techno y diseño sonoro para cine.",
      "params": "Delay Time: 1ms-2000ms, Feedback: 0-110%, Tape Sat: 0-10, Wow/Flutter: 0-100%, Low Cut: 20Hz-2kHz, Ping Pong: On/Off, Mix: 0-100%",
      "externalInput": { "hasExternalInput": false },
      "externalOutput": { "hasExternalOutput": false },
      "sendTo": [
        {
          "id": "b22e8400-e29b-41d4-a716-446655440444",
          "idRef": "992e8400-e29b-41d4-a716-446655440333",
          "description": "Envia la señal con delay hacia la unidad de reverberacion para situarla en un espacio acustico tridimensional."
        }
      ]
    },
    {
      "id": "992e8400-e29b-41d4-a716-446655440333",
      "name": "Final Audio Out",
      "description": "Nodo de salida principal y definitivo de todo el rack de efectos y del sintetizador. Entrega la señal final procesada hacia el exterior. Incluye un limitador final de seguridad de tipo 'brickwall' para garantizar que bajo ninguna circunstancia la señal de salida supere los 0 dBFS evitando asi cualquier tipo de clipping digital en la grabacion final y asegurando la compatibilidad con los estandares de la industria del audio profesional.",
      "params": "Main Volume: -inf a 0dB, Limiter: On/Off, Ceiling: -0.1dB, Stereo Expand: 0-200%, Output Mono: On/Off, Metering: LUFS/RMS, Final Gain: +/- 12dB",
      "externalInput": { "hasExternalInput": false },
      "externalOutput": {
        "hasExternalOutput": true,
        "description": "Salidad final del sintetizador hacia los buses de mezcla o grabacion de la estacion de trabajo de audio digital."
      },
      "sendTo": []
    }
  ]
}
